{
  "package_schema_version": 1,
  "package_id": "bal-2026-w03",
  "authorized_scope": "FULL_OPPONENT_PACKAGE",
  "team_identity": {
    "schema_version": 1,
    "team_id": "bal",
    "team_name": "Baltimore Admirals",
    "season": 2026,
    "as_of_week": 3,
    "record": "2-0",
    "conference": "Continental",
    "division": "Atlantic",
    "competitive_window": "CONTENDER",
    "general_manager": "Nadia Winslow",
    "head_coach": "Caleb Rourke",
    "organizational_summary": "Baltimore is a veteran contender built around controlled offense, protection communication, a powerful defensive front and disguised pressure. The Admirals prefer to make opponents solve repeated details rather than chase constant tempo.",
    "culture_traits": [
      "ASSIGNMENT_DISCIPLINE",
      "VETERAN_TRUST",
      "PHYSICALITY",
      "FIELD_POSITION",
      "LOW_VOLATILITY"
    ],
    "offensive_identity": {
      "name": "Multiple West Coast / wide-zone play action",
      "base_personnel": [
        "11",
        "12",
        "21"
      ],
      "tempo": "DELIBERATE_WITH_SELECTIVE_TEMPO",
      "run_game": [
        "WIDE_ZONE",
        "DUO",
        "INSIDE_ZONE",
        "SPLIT_FLOW"
      ],
      "pass_game": [
        "PLAY_ACTION_OVERS",
        "GLANCE_ROUTES",
        "SAIL",
        "DIG_OVER",
        "TE_SEAMS",
        "BACK_CHECKDOWNS"
      ],
      "protection": "Center-led identification with half-slide, six-man and movement-pocket answers.",
      "core_intent": "Force linebackers and safeties to declare run-fit rules, then throw behind the reaction."
    },
    "defensive_identity": {
      "name": "3-4 / 4-2 hybrid simulated-pressure defense",
      "base_fronts": [
        "ODD",
        "OVER",
        "MINT"
      ],
      "coverage_family": [
        "MATCH_QUARTERS",
        "COVER_3_MATCH",
        "PRESS_MAN",
        "ROBBER"
      ],
      "pressure_tools": [
        "CREEPERS",
        "SIMULATED_PRESSURE",
        "DOUBLE_MUG",
        "EDGE_INTERIOR_GAMES"
      ],
      "core_intent": "Stress protection communication while preserving seven-man coverage pictures."
    },
    "special_teams_identity": {
      "approach": "FIELD_POSITION_FIRST",
      "strengths": [
        "DIRECTIONAL_PUNTING",
        "COVERAGE_DISCIPLINE",
        "SELECTIVE_RETURN_AGGRESSION"
      ]
    },
    "known_availability": [
      {
        "player_id": "bal-damon-kirkland",
        "player_name": "Damon Kirkland",
        "position": "RG",
        "status": "QUESTIONABLE",
        "issue": "Knee status unresolved. St. Louis will prepare as though he will play.",
        "confidence": "VERIFIED_CURRENT_STATE"
      }
    ],
    "provenance_note": "Established as the reusable Week Three Baltimore opponent package after Kevin Dorey authorized full opponent development."
  },
  "team_staff": {
    "schema_version": 1,
    "staff_id": "bal-2026",
    "team_id": "bal",
    "team_name": "Baltimore Admirals",
    "season": 2026,
    "as_of_week": 3,
    "staff": [
      {
        "staff_id": "bal-nadia-winslow",
        "name": "Nadia Winslow",
        "job": "General Manager",
        "department": "FRONT_OFFICE",
        "age": 47,
        "years_with_team": 6,
        "responsibilities": [
          "ROSTER_CONSTRUCTION",
          "CONTRACT_STRATEGY",
          "ORGANIZATIONAL_DIRECTION"
        ],
        "profile": "Patient executive protecting a veteran contention window without treating every short-term need as permission to spend future assets.",
        "voice": "Calm, economical and strategic. States the organizational cost after the football benefit.",
        "decision_lens": "Sustain a contender without hollowing out the next two seasons."
      },
      {
        "staff_id": "bal-caleb-rourke",
        "name": "Caleb Rourke",
        "job": "Head Coach",
        "department": "COACHING",
        "age": 52,
        "years_with_team": 4,
        "responsibilities": [
          "TEAM_PREPARATION",
          "GAME_MANAGEMENT",
          "ROLE_CLARITY"
        ],
        "profile": "Detail-oriented veteran coach whose teams play slowly, physically and with low tolerance for assignment errors.",
        "voice": "Clipped, pragmatic and unsentimental. Separates trust from talent and preparation from reputation.",
        "decision_lens": "Make the opponent execute patiently for four quarters."
      },
      {
        "staff_id": "bal-marisol-vega",
        "name": "Marisol Vega",
        "job": "Offensive Coordinator",
        "department": "COACHING",
        "age": 41,
        "years_with_team": 3,
        "responsibilities": [
          "OFFENSIVE_DESIGN",
          "SEQUENCING",
          "QUARTERBACK_PLAN"
        ],
        "profile": "Builds a multiple-personnel offense around formation shifts, wide-zone conflict and play-action answers.",
        "voice": "Precise and fast when discussing leverage. Frames calls as sequences rather than isolated plays.",
        "decision_lens": "Force defenders to declare their rules, then attack the rule."
      },
      {
        "staff_id": "bal-gideon-price",
        "name": "Gideon Price",
        "job": "Defensive Coordinator",
        "department": "COACHING",
        "age": 46,
        "years_with_team": 4,
        "responsibilities": [
          "DEFENSIVE_DESIGN",
          "PRESSURE_PLAN",
          "THIRD_DOWN"
        ],
        "profile": "Aggressive protection-stress coordinator who combines simulated pressure with disciplined match coverage.",
        "voice": "Blunt and diagnostic. Names the communication failure he is trying to create.",
        "decision_lens": "Make the quarterback and center solve different pictures before the snap."
      },
      {
        "staff_id": "bal-emmett-shaw",
        "name": "Emmett Shaw",
        "job": "Special Teams Coordinator",
        "department": "COACHING",
        "age": 48,
        "years_with_team": 2,
        "responsibilities": [
          "COVERAGE_UNITS",
          "RETURN_GAME",
          "FIELD_POSITION"
        ],
        "profile": "Conservative field-position coach with strong coverage standards and selective return aggression.",
        "voice": "Practical and detail-heavy. Talks in landmarks, operation time and hidden yards.",
        "decision_lens": "Win field position without donating a volatility play."
      },
      {
        "staff_id": "bal-theo-larkin",
        "name": "Theo Larkin",
        "job": "Quarterbacks Coach",
        "department": "COACHING",
        "age": 38,
        "years_with_team": 3,
        "responsibilities": [
          "QUARTERBACK_DEVELOPMENT",
          "PROTECTION_COMMUNICATION"
        ],
        "profile": "Works closely with Dorian Hale on coverage confirmation and pressure answers.",
        "voice": "Methodical and question-driven. Tests the quarterback’s answer instead of giving it away.",
        "decision_lens": "Keep Hale on schedule and out of unnecessary second reactions."
      },
      {
        "staff_id": "bal-ramon-sykes",
        "name": "Ramon Sykes",
        "job": "Running Backs Coach",
        "department": "COACHING",
        "age": 43,
        "years_with_team": 2,
        "responsibilities": [
          "RUNNING_BACK_ROTATION",
          "BALL_SECURITY",
          "PASS_PROTECTION"
        ],
        "profile": "Demands decisive reads and treats pass protection as the price of third-down snaps.",
        "voice": "Direct and compact. Praises decisions more than yardage.",
        "decision_lens": "Preserve Boone while keeping the offense’s identity intact."
      },
      {
        "staff_id": "bal-jasper-wynn",
        "name": "Jasper Wynn",
        "job": "Wide Receivers Coach",
        "department": "COACHING",
        "age": 36,
        "years_with_team": 3,
        "responsibilities": [
          "RELEASE_PLAN",
          "ROUTE_DETAIL",
          "BLOCKING"
        ],
        "profile": "Technician focused on releases, spacing and late-route body control.",
        "voice": "Specific and visual. Describes leverage and body position in short corrections.",
        "decision_lens": "Create clean pictures for Hale without tipping the route family."
      },
      {
        "staff_id": "bal-colin-havel",
        "name": "Colin Havel",
        "job": "Offensive Line Coach",
        "department": "COACHING",
        "age": 55,
        "years_with_team": 5,
        "responsibilities": [
          "PROTECTION_RULES",
          "RUN_GAME_COMBINATIONS",
          "LINE_ROTATION"
        ],
        "profile": "Veteran line coach whose unit wins through communication and five-man cohesion.",
        "voice": "Measured and literal. Refuses to blame one blocker before confirming the protection rule.",
        "decision_lens": "Keep the interior connected if Kirkland is limited or unavailable."
      },
      {
        "staff_id": "bal-anton-briggs",
        "name": "Anton Briggs",
        "job": "Defensive Line Coach",
        "department": "COACHING",
        "age": 44,
        "years_with_team": 4,
        "responsibilities": [
          "FRONT_TECHNIQUE",
          "RUSH_GAMES",
          "RUN_CONTROL"
        ],
        "profile": "Builds the front around Vickers’ power and coordinated edge/interior games.",
        "voice": "Sparse and technical. Talks hands, hips and rush spacing.",
        "decision_lens": "Compress the pocket without opening escape lanes."
      },
      {
        "staff_id": "bal-tariq-mullen",
        "name": "Tariq Mullen",
        "job": "Linebackers Coach",
        "department": "COACHING",
        "age": 39,
        "years_with_team": 2,
        "responsibilities": [
          "RUN_FITS",
          "MATCH_COVERAGE",
          "GREEN_DOT_SUPPORT"
        ],
        "profile": "Prioritizes eye discipline and route distribution in Baltimore’s match structures.",
        "voice": "Calm, corrective and assignment-first.",
        "decision_lens": "Make play action expensive without vacating the intermediate middle."